{
  "org": "페이퍼트레일 교육원",
  "refNo": "TRN-2026-000123",
  "recipient": {
    "name": "홍길동",
    "employeeId": "E-10482",
    "department": "안전보건팀"
  },
  "course": {
    "title": "직장 내 안전보건 기본과정",
    "period": "2026-07-06 ~ 2026-07-24",
    "totalHours": 16
  },
  "sessions": [
    { "date": "2026-07-06", "topic": "위험성 평가 기초", "hours": 4 },
    { "date": "2026-07-13", "topic": "비상대응 훈련", "hours": 6 },
    { "date": "2026-07-24", "topic": "평가 및 정리", "hours": 6 }
  ],
  "result": { "passed": true, "score": 92 },
  "issuedAt": "2026-07-29",
  "issuer": { "name": "김철수", "title": "교육원장" }
}
